[
  {
    "id": "ocd-organization/67222dec-949d-575b-8060-18e237953350",
    "name": "Select Board Member",
    "jurisdiction_id": "ocd-jurisdiction/country:us/state:ma/place:nahant/government",
    "identifiers": [
      {
        "scheme": "civicmirror-office",
        "identifier": "nahant-ma/select-board"
      }
    ],
    "status": "active",
    "sources": [
      {
        "url": "https://www.nahant.org/town-clerk/elections/",
        "retrieved": "2026-08-25"
      }
    ]
  },
  {
    "id": "ocd-organization/79dd5f00-7db0-5a95-a447-569c20078763",
    "name": "Town Moderator",
    "jurisdiction_id": "ocd-jurisdiction/country:us/state:ma/place:nahant/government",
    "identifiers": [
      {
        "scheme": "civicmirror-office",
        "identifier": "nahant-ma/moderator"
      }
    ],
    "status": "active",
    "sources": [
      {
        "url": "https://www.nahant.org/town-clerk/elections/",
        "retrieved": "2026-08-25"
      }
    ]
  },
  {
    "id": "ocd-organization/4c63e259-e13f-5c99-a36a-84d5d4a155fc",
    "name": "Town Clerk",
    "jurisdiction_id": "ocd-jurisdiction/country:us/state:ma/place:nahant/government",
    "identifiers": [
      {
        "scheme": "civicmirror-office",
        "identifier": "nahant-ma/town-clerk"
      }
    ],
    "status": "active",
    "sources": [
      {
        "url": "https://www.nahant.org/town-clerk/elections/",
        "retrieved": "2026-08-25"
      }
    ]
  },
  {
    "id": "ocd-organization/888fc0a7-7f7d-5885-b2ca-c1dd86cf64df",
    "name": "Assessor",
    "jurisdiction_id": "ocd-jurisdiction/country:us/state:ma/place:nahant/government",
    "identifiers": [
      {
        "scheme": "civicmirror-office",
        "identifier": "nahant-ma/board-of-assessors"
      }
    ],
    "status": "active",
    "sources": [
      {
        "url": "https://www.nahant.org/town-clerk/elections/",
        "retrieved": "2026-08-25"
      }
    ]
  },
  {
    "id": "ocd-organization/5a00c8e4-d66d-5b1e-a959-28dfeb62b823",
    "name": "Constable",
    "jurisdiction_id": "ocd-jurisdiction/country:us/state:ma/place:nahant/government",
    "identifiers": [
      {
        "scheme": "civicmirror-office",
        "identifier": "nahant-ma/constable"
      }
    ],
    "status": "active",
    "sources": [
      {
        "url": "https://www.nahant.org/town-clerk/elections/",
        "retrieved": "2026-08-25"
      }
    ]
  },
  {
    "id": "ocd-organization/3cdf7ac6-515b-5ab7-9327-6a2a31b6bd73",
    "name": "Library Trustee",
    "jurisdiction_id": "ocd-jurisdiction/country:us/state:ma/place:nahant/government",
    "identifiers": [
      {
        "scheme": "civicmirror-office",
        "identifier": "nahant-ma/library-trustees"
      }
    ],
    "status": "active",
    "sources": [
      {
        "url": "https://www.nahant.org/town-clerk/elections/",
        "retrieved": "2026-08-25"
      }
    ]
  },
  {
    "id": "ocd-organization/a3b5ac77-d30e-5660-bf5e-0c60a6a6805a",
    "name": "School Committee Member",
    "jurisdiction_id": "ocd-jurisdiction/country:us/state:ma/place:nahant/government",
    "identifiers": [
      {
        "scheme": "civicmirror-office",
        "identifier": "nahant-ma/school-committee"
      }
    ],
    "status": "active",
    "sources": [
      {
        "url": "https://www.nahant.org/town-clerk/elections/",
        "retrieved": "2026-08-25"
      }
    ]
  },
  {
    "id": "ocd-organization/ce9cd65f-79a2-5449-8f09-700ab78592cd",
    "name": "Planning Board Member",
    "jurisdiction_id": "ocd-jurisdiction/country:us/state:ma/place:nahant/government",
    "identifiers": [
      {
        "scheme": "civicmirror-office",
        "identifier": "nahant-ma/planning-board"
      }
    ],
    "status": "active",
    "sources": [
      {
        "url": "https://www.nahant.org/town-clerk/elections/",
        "retrieved": "2026-08-25"
      }
    ]
  },
  {
    "id": "ocd-organization/00436dd8-1277-5b6f-a7e1-500df263efbd",
    "name": "Housing Authority Member",
    "jurisdiction_id": "ocd-jurisdiction/country:us/state:ma/place:nahant/government",
    "identifiers": [
      {
        "scheme": "civicmirror-office",
        "identifier": "nahant-ma/housing-authority"
      }
    ],
    "status": "active",
    "sources": [
      {
        "url": "https://www.nahant.org/town-clerk/elections/",
        "retrieved": "2026-08-25"
      }
    ]
  },
  {
    "id": "ocd-organization/67596aed-a0fa-5662-baa5-914c7b110002",
    "name": "Select Board Member",
    "jurisdiction_id": "ocd-jurisdiction/country:us/state:ma/place:new-ashford/government",
    "identifiers": [
      {
        "scheme": "civicmirror-office",
        "identifier": "new-ashford-ma/select-board"
      }
    ],
    "status": "active",
    "sources": [
      {
        "url": "https://newashfordma.gov/wp-content/uploads/2024/10/Town-Bylaws.pdf",
        "retrieved": "2026-08-25"
      }
    ]
  },
  {
    "id": "ocd-organization/5b28a419-2def-5ca1-b932-c98aa8028741",
    "name": "Town Clerk and Treasurer",
    "jurisdiction_id": "ocd-jurisdiction/country:us/state:ma/place:new-ashford/government",
    "identifiers": [
      {
        "scheme": "civicmirror-office",
        "identifier": "new-ashford-ma/town-clerk-treasurer"
      }
    ],
    "status": "active",
    "sources": [
      {
        "url": "https://newashfordma.gov/wp-content/uploads/2024/10/Town-Bylaws.pdf",
        "retrieved": "2026-08-25"
      }
    ]
  },
  {
    "id": "ocd-organization/ebb22eac-347d-57e1-ac6a-a6a8ad5ff75a",
    "name": "Assessor",
    "jurisdiction_id": "ocd-jurisdiction/country:us/state:ma/place:new-ashford/government",
    "identifiers": [
      {
        "scheme": "civicmirror-office",
        "identifier": "new-ashford-ma/assessor"
      }
    ],
    "status": "active",
    "sources": [
      {
        "url": "https://newashfordma.gov/wp-content/uploads/2024/10/Town-Bylaws.pdf",
        "retrieved": "2026-08-25"
      }
    ]
  },
  {
    "id": "ocd-organization/10ce5f09-f6da-5542-ade1-57bd98f87148",
    "name": "Collector of Taxes",
    "jurisdiction_id": "ocd-jurisdiction/country:us/state:ma/place:new-ashford/government",
    "identifiers": [
      {
        "scheme": "civicmirror-office",
        "identifier": "new-ashford-ma/collector-of-taxes"
      }
    ],
    "status": "active",
    "sources": [
      {
        "url": "https://newashfordma.gov/wp-content/uploads/2024/10/Town-Bylaws.pdf",
        "retrieved": "2026-08-25"
      }
    ]
  },
  {
    "id": "ocd-organization/f5d2c9bc-01bd-5a97-9f55-4f730037d798",
    "name": "Tree Warden",
    "jurisdiction_id": "ocd-jurisdiction/country:us/state:ma/place:new-ashford/government",
    "identifiers": [
      {
        "scheme": "civicmirror-office",
        "identifier": "new-ashford-ma/tree-warden"
      }
    ],
    "status": "active",
    "sources": [
      {
        "url": "https://newashfordma.gov/wp-content/uploads/2024/10/Town-Bylaws.pdf",
        "retrieved": "2026-08-25"
      }
    ]
  },
  {
    "id": "ocd-organization/1c4c1566-faf8-5c05-9c83-8fddd9fc2c6d",
    "name": "School Committee Member",
    "jurisdiction_id": "ocd-jurisdiction/country:us/state:ma/place:new-ashford/government",
    "identifiers": [
      {
        "scheme": "civicmirror-office",
        "identifier": "new-ashford-ma/school-committee"
      }
    ],
    "status": "active",
    "sources": [
      {
        "url": "https://newashfordma.gov/wp-content/uploads/2024/10/Town-Bylaws.pdf",
        "retrieved": "2026-08-25"
      }
    ]
  },
  {
    "id": "ocd-organization/442ba0b4-10d5-5537-9cb0-a08a673e31e0",
    "name": "Board of Health Member",
    "jurisdiction_id": "ocd-jurisdiction/country:us/state:ma/place:new-ashford/government",
    "identifiers": [
      {
        "scheme": "civicmirror-office",
        "identifier": "new-ashford-ma/board-of-health"
      }
    ],
    "status": "active",
    "sources": [
      {
        "url": "https://newashfordma.gov/wp-content/uploads/2024/10/Town-Bylaws.pdf",
        "retrieved": "2026-08-25"
      }
    ]
  },
  {
    "id": "ocd-organization/169c87a6-4118-510b-b964-5e0cbe5a7d3b",
    "name": "Library Trustee",
    "jurisdiction_id": "ocd-jurisdiction/country:us/state:ma/place:new-ashford/government",
    "identifiers": [
      {
        "scheme": "civicmirror-office",
        "identifier": "new-ashford-ma/library-trustees"
      }
    ],
    "status": "active",
    "sources": [
      {
        "url": "https://newashfordma.gov/wp-content/uploads/2024/10/Town-Bylaws.pdf",
        "retrieved": "2026-08-25"
      }
    ]
  },
  {
    "id": "ocd-organization/542a720d-2788-5a0d-b756-ac2cc2f04a73",
    "name": "Town Moderator",
    "jurisdiction_id": "ocd-jurisdiction/country:us/state:ma/place:new-ashford/government",
    "identifiers": [
      {
        "scheme": "civicmirror-office",
        "identifier": "new-ashford-ma/moderator"
      }
    ],
    "status": "active",
    "sources": [
      {
        "url": "https://newashfordma.gov/wp-content/uploads/2024/10/Town-Bylaws.pdf",
        "retrieved": "2026-08-25"
      }
    ]
  },
  {
    "id": "ocd-organization/042761b9-c630-5ab2-af4e-1ef8002d0f9f",
    "name": "Town Auditor",
    "jurisdiction_id": "ocd-jurisdiction/country:us/state:ma/place:new-ashford/government",
    "identifiers": [
      {
        "scheme": "civicmirror-office",
        "identifier": "new-ashford-ma/auditor"
      }
    ],
    "status": "active",
    "sources": [
      {
        "url": "https://newashfordma.gov/wp-content/uploads/2024/10/Town-Bylaws.pdf",
        "retrieved": "2026-08-25"
      }
    ]
  },
  {
    "id": "ocd-organization/70e075fc-fc1b-505a-970b-e5d0ed665d91",
    "name": "Planning Board Member",
    "jurisdiction_id": "ocd-jurisdiction/country:us/state:ma/place:new-ashford/government",
    "identifiers": [
      {
        "scheme": "civicmirror-office",
        "identifier": "new-ashford-ma/planning-board"
      }
    ],
    "status": "active",
    "sources": [
      {